{
  "schemaVersion": 4,
  "kind": "novel",
  "id": "sh-tales",
  "status": "ongoing",
  "icon": "images/book/sword.png",
  "volumes": [
    {
      "id": "case-01",
      "chapters": [
        {
          "id": "ep-01"
        },
        {
          "id": "ep-02"
        },
        {
          "id": "ep-05"
        }
      ]
    },
    {
      "id": "case-02",
      "chapters": [
        {
          "id": "prologue"
        },
        {
          "id": "ep-05"
        }
      ]
    }
  ]
}
